"country_name","field","comment_field","variant_field"
"France","Que les délinquants soient relâchés dans la nature malgres qu'ils soient arrêtés tous les 4matins par la police. Donc la plus grande injustice, c'est la justice",NA,"injustice"
"Germany","Nichts",NA,"wish"
"United Kingdom","For me and my family to be happy and healthy. To feel safe in our country. Have a good amount of disposable income to treat myself. To go on holidays multiple times a year",NA,"wish"
"Italy","SALUTE E SOLDI","NO COMMENT","wish"
"Poland","Stan zdrowia","w kilku przypadkach było dwa razy ""nie"" zamiast tak lub nie, w przypadku wyboru alternatywy.","concerns"
"Spain","Vivienda y los salarios muy bajos, robos y ocupación de los pisos, vienen muchos extranjeros de afuera",NA,"concerns"
"Saudi Arabia","لا يوجد",NA,"issue"
"USA","Trump is running the country for 4 years",NA,"concerns"
"USA","My needs are to be able to pay off some my debt and I wish I could win the lottery.","Nothing comes to mind.","wish"
"Germany",NA,NA,"wish"
"Japan","自由の有無","なし","injustice"
"France","La Russie avec la guerre en Ukraine et maintenant en plaçant des troupes frontalières Finlande, Israël et Gaza, donc un inflation très forte. Autre préoccupation avoir un président de la république qui est nul, qui croit être en monarchie pas à l’écoute et fait comme il veut","Je pense pour le moment que je resterai sur le même parti","concerns"
"France","de sérénité et sécurité",NA,"wish"
"France","le pouvoir d achat des francais moyen",NA,"issue"
"Switzerland","La grande differenza di stipendio",NA,"injustice"
"Japan","リボ払いが終わらない","米が安く買えるようになってほしい","concerns"
"Switzerland","Pauvresse","Rien a signaler","injustice"
"Japan","税金問題


お米の値上がり


物価の上昇",NA,"wish"
"Italy","sostegno per i disabili",NA,"issue"
"Japan","暗号資産の行方",NA,"concerns"
"Germany","Krieg",NA,"injustice"
"Japan","子育てしやすく、老後自分も、子供達も住み良い将来であり続ける世の中の仕組みでいてほしいです。",NA,"wish"
"Japan","消費税廃止
社会保険減税
ガソリン税廃止",NA,"issue"
"France","le pouvoir d'achat","ras","concerns"
"Japan",NA,NA,"wish"
"France","je n'ai besoin de rien Je souhaite la paix dans le monde et plus d'écologie",NA,"wish"
"Italy","La pace nel mondo",NA,"issue"
"United Kingdom","Racial equality","I did not completely understand a question so could not give an answer","issue"
"Germany","Job der mich ausfüllt",NA,"wish"
"France","La pauvreté",NA,"injustice"
"Italy","sicurezza sulle piazze",NA,"issue"
"Italy","Soldi da investire per il futuro, più tempo per riposare dal lavoro specialmente nel weekend e nelle feste nella quale lavoro sempre","Credo che la società sarebbe più propensa all’altruismo se gli “altri” non fosse il tema principale degli ultimi 15 anni di governi di sinistra. Siamo assillati dall’imposizione di un modello di pensiero che sta inducendo a un odio che non c’era.","wish"
"Italy","il cambiamento sociale",NA,"concerns"
"United Kingdom","THE ISSUE THAT IS IMPORTANT TO ME BUT I NEGLECTED IS FUNDING AND MENTAL HEALTH SUPPORT.",NA,"issue"
"United Kingdom","Being brough into the world in a place that would never be able to sustain you and suffering and causing others to suffer because of it
",NA,"injustice"
"United Kingdom","Cost of living/maternity and paternity rights",NA,"issue"
"United Kingdom","Providing excellent facilities for illegal immigrants using our tax money","Very interesting survey. Questions were clear and easy to answer","issue"
"United Kingdom","In my opinion, NHS endless waiting problem has not gotten adequate attention.","It's a great opportunity to participate it this survey.","issue"
"United Kingdom","Old age victimisation",NA,"injustice"
"United Kingdom","Just keeping my independance",NA,"concerns"
"United Kingdom","Imprisoning people when they are innocent",NA,"injustice"
"United Kingdom","The important social and economic value of immigrants.",NA,"issue"
"United Kingdom","to be happy and healthy and that my family is to",NA,"wish"
"United Kingdom","Cost of living and being able to afford unexpected expenses","Was a fun exercise and thought provoking","concerns"
"United Kingdom","The people affected by war and conflict. They didnot contribute to the conflict but were just trying to get on with their lives.",NA,"injustice"
"Switzerland",NA,NA,"injustice"
"United Kingdom","My health as well as trying to stay generally fit.",NA,"concerns"
"United Kingdom","workers rights","none","issue"
"United Kingdom","I wish to live  happy life with my family and grow to an old age with my partner.","I would love to participate more in such surveys. It was brilliant.","wish"
"United Kingdom","My main concerns these days are the rate of unemployment, healthcare is increasingly becoming expensive, and the economy.","I don't have any suggestions for now.","concerns"
"Switzerland","Das immer dem Mittelstand alles genommen wird",NA,"injustice"
"Italy","non essere curati come si dovrebbe",NA,"injustice"
"United Kingdom","I have mobility problems and an essential tremor.  It would be good if these could be alleviated","I assume this was an American survey - a bit rich considering what their current administration thinks of foreigners!","wish"
"USA","To pay off school loans",NA,"wish"
"USA","Enforcment of Immigration and Benefit Purpose Fraud",NA,"issue"
"USA","Civil rights",NA,"injustice"
"USA","I dont know","na","injustice"
"USA","Making it easy to own guns",NA,"injustice"
"USA","I believe we have forgotten about the world's water situation. I remember like ten or so years ago it was a big issue, and then all of a sudden overnight the issue was gone.","I enjoyed this survey. I believe these questions are not typically asked, thought of often or really even known to people as a whole. We're too busy caught up in the rat race.","issue"
"USA","help centers for b lacks","I have none","issue"
"USA","Money","None","wish"
"USA","My wishes are that my family be healthy and successful, never having to worry about their future. I need to maintain my health and to continue to be happy","Thought provoking survey","wish"
"USA","the government",NA,"concerns"
"USA","The mass shooters","We do need to offset debt distribution","concerns"
"USA","I would like to be financially stable at some point.",NA,"wish"
"USA","Financial stability, support, security, health and wellness",NA,"wish"
"USA","Inflation","We need to focus on inflation in America","issue"
"USA","Then justice is to make the rich richer and the poor poorer",NA,"injustice"
"USA","092616","092616","concerns"
"United Kingdom","LIVE A GOOD EASY LIFE FOR AT LEAST THE NEXT 10 YEARS.","VERY INTERESTING. A FEW OF THE QUESTIONS I FOUND HARD TO ANSWER.","wish"
"USA","Slavery",NA,"injustice"
"USA","Immigration taking over",NA,"injustice"
"USA","to live a stress free life; know I'm able to afford the things I need","thank you","wish"
"USA","shipping the imagrents to another country without due process",NA,"injustice"
"USA","Inflation is one of the biggest issues out there.","The simple platform made it easy to navigate through the survey.","issue"
"USA","No issue was neglected",NA,"issue"
"USA","Peace of mind, good health and more blessings","Interesting survey. Enjoy giving my responses. Keep it up","wish"
"USA","My main concern is day to day living with not much concern for the future",NA,"concerns"
"USA","I wish for more leisure time.",NA,"wish"
"USA","To purchase my own home.",NA,"wish"
"USA","Stability, the job market,  respect, and product cost.",NA,"concerns"
"USA","having the fire happen and no one helping out",NA,"injustice"
"USA","More help and have more financial freedom to support my family",NA,"wish"
"USA","CLIMATE CHANGE","NONE","issue"
"France","effectuer des travaux dans mon logement",NA,"wish"
"USA","the plight of the black man in America","thank you for the opportunity to win...","injustice"
"France","Le pouvoir d achat",NA,"concerns"
"USA","New car pay off my Home and bills","Suvey was kind of long","wish"
"USA","Slavery","Great survey and hope my info helps","injustice"
"USA","Being very successful in life and not have too many worries. Providing for my family and giving them everything they need and want.","It was a great survey. Thank you so much. Have a great day.","wish"
"USA","Criminal reform",NA,"issue"
"USA","The country moving backwards and the increase of racism.","The survey was perfect.","concerns"
"USA","Homelessness mental health and affordable housing",NA,"issue"
"USA","the rich taking from the poor",NA,"injustice"
"USA","Racism is","No comments","injustice"
"USA","Inflation being a big issue in the country","This was more informative than I thought","concerns"
"USA","When human rights are violated it affects people of all races and nationalities.","I do not have anything to contribute at this time.","injustice"
"USA","My needs and wishes are different.","None","wish"
"USA","I am not sure",NA,"injustice"
"USA","High Tarriffs, immgration.",NA,"concerns"
"USA","To see me getting rid of the cancer in my body and to see all my kids prosper in life",NA,"wish"
"United Kingdom","Park tidiness",NA,"issue"
"USA","Social Security and the economy",NA,"issue"
"USA","I need and wish to get healthier and more income.","You are pushing an agenda.","wish"
"USA","Inflation","Interesting","issue"
"USA","The rise of inflation, crime and housing costs",NA,"concerns"
"USA","Have my own house in Henderson, NC. Find my future wife overseas. Create a profitable job or business for myself so that I don't quit, get laid off, or be terminated every time...","This survey alone can be an educational course. I have learned much.","wish"
"USA","I need money and a nice person to share it with",NA,"wish"
"USA","Healthcare is extremely important. It's not neglected but it always has to be in the forefront","I enjoy this type of survey","issue"
"USA","My meds and not having enough after paying my bill","I have none","concerns"
"USA","I need a job","I don't have any suggestions","wish"
"USA","High price and medicaid",NA,"issue"
"USA","Everything that Trump is doing because he's a tyrant. he's putting America back 100 years. i'm concerned about human rights Equality for all. I have a concern for the health care and the Medicaid they're trying to roll back. i'm concerned about the Department of Education And I'm concerned about our environment. concerned about what he's doing to all the national parks","I don't think we will ever join until Trump is out of office since he is a narcissist tyrant","concerns"
"USA","THE RIGHTS OF LEGAL IMMIGRANTS IN AMERICAN SOCIETY",NA,"issue"
"USA","African Americans being over represented as far as poverty goes.","I liked the survey , thank you.","issue"
"USA","I need more economic stability and more opportunities to grow my savings and investments.","none","wish"
"USA","happy life style",NA,"wish"
"USA","TO LIVE LONG AND PROSPER IN PEACE",NA,"wish"
"USA","To have what I need for my family for the coming day","None","wish"
"USA","Na","Na","issue"
"USA","Not being able to complete school",NA,"injustice"
"USA","Homeless","None","issue"
"Italy","Più soldi",NA,"wish"
"USA","Most black cases",NA,"injustice"
"USA","cost of living",NA,"issue"
"USA","to invest in stocks and trades",NA,"wish"
"USA","That people will treat eacher better. Have mutual respect for each other. Embracing difference and seeing each other as all Gods children.","It was a very challenging survey.","wish"
"USA","La explotacion infantil.","Me parece una encuesta muy interesante.","injustice"
"USA","finances, inflation, cost of living",NA,"concerns"
"USA","Racial profiling",NA,"injustice"
"USA","To live a peaceful life but have the ability to embark on adventures with my wife",NA,"wish"
"USA","To live life","Nothing","wish"
"USA","Health benefits childcare for working parents","N/A","concerns"
"USA","Since my health is good, and my income exceeds my needs, I have no concerns.",NA,"concerns"
"USA","I want my mother to be cancer free I want a good husband to start a family with",NA,"wish"
"USA","My main concern is having a steady country and have alot of peace","This was a really good survey and it made alot of sense","concerns"
"USA","The prices are increasing because of the imposed tariffs on everything....","No Comment","concerns"
"USA","Corruption in the white house",NA,"concerns"
"USA","i wish i could have more money and more vacations",NA,"wish"
"USA","My needs and wishes are to buy me a 2-bedroom 1-bathroom house","none","wish"
"USA","Not having enough money to pay my bills","Good overall survey","concerns"
"USA","That trump won being a convicted felon","Thanks","injustice"
"USA","The people who broke into the white house","Nothing else","injustice"
"USA","Racisium","I was ok","injustice"
"USA","To be financially successful",NA,"wish"
"USA","To be the better person I was yesterday","Very helpful survey","wish"
"USA","Spending","To interesting and complex","issue"
"USA","serving time in jail for a crime you did not commit","no comments","injustice"
"USA","The economy is in trouble but hopefully things will get better.","There is nothing else for me at this time. It is a great survey though.","concerns"
"USA","the greatest injustice is the democratic party, are are very bad","i hope i get some credit for this survey because this was confusing.","injustice"
"USA","Trying to make sure i am finacially stable.","No comments","concerns"
"USA","To stay financially stable","Keep them short and to the point","wish"
"USA","I need to get a job. I want some chips or something to snack on.",NA,"wish"
"USA","to not be asked irrelevant questions","i have nothing to add","wish"
"USA","Money",NA,"wish"
"USA","The price of food, Finding decent Employment","None in this case","concerns"
"USA","I would say when people re just rude and racist. we need to quit being so judgmental to others.","Great survey","injustice"
"USA","Racism",NA,"injustice"
"USA","Inflation","This survey was conducted perfectly.","concerns"
"USA","Poverty and inequality are the main factors in this country",NA,"issue"
"USA","Killing children.",NA,"injustice"
"USA","The state of the country we divided",NA,"concerns"
"USA","The economic state of the country right now",NA,"issue"
"USA","Inflation,  SS, Medicare, Medicaid, Rent rising every year,  Tariffs, Just Life.",NA,"concerns"
"USA","to be wealthy and strong minded individual",NA,"wish"
"Italy","Casa",NA,"wish"
"USA","My wish is to become a millionaire and travel the world","None","wish"
"USA","how am I going to live a happy life and have more meaningful relationships that don't feel one sided","none","concerns"
"USA","likey","likey
","issue"
"USA","Healthcare and affordable housing.","nothing else","concerns"
"USA","An issue that is important to me that was neglected in the public debate are homelessness",NA,"issue"
"USA","Home for the best of them","Cool","issue"
"USA","Free Healthcare","None","issue"
"USA","None","Nothing","issue"
"USA","I just want someone who is there for the people I'm confuse who could be","no comment","issue"
"United Kingdom","Immigration and cost of living",NA,"concerns"
"USA","Our environment","I have none","issue"
"France","L argent",NA,"concerns"
"USA","My needs is to have a great job to make sure my daughter and I are safe. My wishes is for my daughter and i to live a long and healthy life.",NA,"wish"
"USA","Rise in cost of all products","None","concerns"
"USA","Immigration and I am interested in Japanese",NA,"issue"
"USA","Social security",NA,"issue"
"USA","I wish i was so rich i could afford anything i like","I do not have any comment at the moment.","wish"
"USA","I will definitely say unlawfully locking people up and putting them in jail for a long periods of time","This was fun","injustice"
"USA","Racism",NA,"injustice"
"USA","To live clean healthy life","No","wish"
"USA","NO I CAN'T",NA,"issue"
"USA","I can’t really answer that question","No nothing","injustice"
"USA","Climate control","Thank you for allowing me to participate in this survey it was interesting and fun.","issue"
"United Kingdom","The Arts",NA,"issue"
"USA","Treating living beings and things bad","None","injustice"
"USA","fair housing and fair wages",NA,"issue"
"USA","Economy and safety","No comments","concerns"
"USA","The high cost of food.","very good survey","concerns"
"USA","Electing a criminal to the White House.","I do not have any additional comments.","injustice"
"USA","Crime is bad",NA,"issue"
"USA","health econmy",NA,"concerns"
"USA","Homeless and employment issues. We help everyone else but ourselves and I need to know I will have a job",NA,"concerns"
"USA","I wish to have a affordable housing and healthcare for me and my family",NA,"wish"
"USA","The greatest injustice of all is racism.",NA,"injustice"
"USA","To find peace within myself","Great survey","wish"
"USA","Inflation","Fun","issue"
"USA","Having enough money to get the things I need",NA,"concerns"
"USA","Freedom and liberty. Money, weed, pussy and good entrees.","I need money.","wish"
"USA","The issue of teaching children about transgenderism","This survey is very interesting","issue"
"USA","I don’t really have needs and wishes","Reliable","wish"
"United Kingdom","All my family to enjoy good health and happiness.",NA,"wish"
"USA","I wish to start my own business so that I can make more money.","I really don't know what to say.","wish"
"USA","Too be successful in life own a car","I learned today","wish"
"USA","What I need is a very good health and the same goes to my family and I wish the same thing for the whole world without hunger.",NA,"wish"
"USA","Denied people’s rights to live free","No comment","injustice"
"USA","being targeted because of your beliefs","finally an interesting survey, thank you","injustice"
"USA","Climate change and economic issues",NA,"issue"
"USA","Understanding it best with","Grewat","injustice"
"USA","Inflation and climate change",NA,"concerns"
"USA","To be able to help my daughter with the mortgage","Nothing comes up","wish"
"USA","It’s good i like it","It’s good for","issue"
"USA","Donald trump not going to jail for the crimes he committed","This survey was very interesting, made me think of something i never thought about. Enjoyed the survey thanks","injustice"
"USA","inflation",NA,"issue"
"USA","the economy at the moment",NA,"concerns"
"USA","Racism",NA,"injustice"
"USA","healthcare","none to add","issue"
"USA","To have Job paying equivalent to the economy standards","I have no thoughts or comments about this","wish"
"USA","The economy","I am a bit confused with the end of this survey.","concerns"
"USA","Not having enough money to pay my bills","None","concerns"
"USA","Poverty is a major concern with significant differences between rural and urban areas.","No comment. The Survey was great.","concerns"
"USA","To get a better so I can have a better life","It was interesting","wish"
"USA","we are no longer  a Country of Equality for all","as a country of many with and many without
we should be more willing to share","injustice"
"USA","Nothing","Nothing","wish"
"USA","That my kids grow up and are successful, that me and my wife remain happy.","Very good survey, important.","wish"
"USA","Affordable Housing",NA,"issue"
"USA","When there were no laws in ancient times, many people suffered unreasonable human rights inequalities, and laws were supposedly created to correct them. and yet, the leaders of countries disregarding the law makes me think there is no greater injustice.","none in particular","injustice"
"USA","Nope","No comment","issue"
"USA","The price of healthcare in this country",NA,"injustice"
"USA","my concern is for the economy praying for improvement soon",NA,"concerns"
"USA","That rich people can get out of the consequences of any crime.",NA,"injustice"
"USA","To have a better life and a good home","None","wish"
"USA","Trump is ruining and dividing the country",NA,"concerns"
"USA","The cost of living and the available jobs","I thought it was very interesting. I’ve never taken a survey like this","issue"
"USA","Innocent people going to jail",NA,"injustice"
"USA","Having enough money for bills and daily and future expenses.",NA,"concerns"
"USA","To become closer to God and financially stable","Very good quality","wish"
"USA","Nonetheless","Nonetheless","issue"
"USA","I think that gambling in sports is my biggest concern and I don't like it honestly","I have none","concerns"
"USA","The issue of inflation needs to be discussed more.","It was interesting.","issue"
"USA","Inflation diversity blatant dictatorship and racism",NA,"concerns"
"USA","Medicare problems and violence problems","This was okay","issue"
"USA","Rent and groceries","Add more points","concerns"
"USA","The president who is ruining the world.","Great survey. Thank you.","injustice"
"USA","Money","None","concerns"
"USA","All of them","Nothing","concerns"
"USA","It’s amazing",NA,"issue"
"USA","I am concerned with my financial situation, grocery prices going up, and the federal government being out of control.","Some of the ideas in the survey were encouraging.","concerns"
"USA","To have more money. Be able to have extra money","It's was interesting and I learned a lot of new things.","wish"
"USA","Everything is so expensive groceries gas bills it’s hard to live",NA,"concerns"
"USA","My main concerns are being able to afford groceries, the crime in my city and whether or not things happening all over will affect me and my loved ones","This survey was pretty cool","concerns"
"USA","Inflation","None","issue"
"USA","Immigration, will they become cittizens","None at this time","issue"
"USA","inflation",NA,"concerns"
"USA","My needs and wishes are everything I want","This survey was great","wish"
"USA","Nothing","I like surveys","injustice"
"USA","I cannot think of any.","I have no comments.","injustice"
"USA","Taking away freedom of speech","no comments","injustice"
"USA","The economy","Great survey good topic","issue"
"USA","Senior issues","Very informative","issue"
"USA","Inflation and crime","Interesting survey","concerns"
"Italy","Caro vita",NA,"concerns"
"USA","Financial concerns","God bless","concerns"
"USA","To have stability in life.",NA,"wish"
"USA","I can't think of anything at this time","Thank you !!!","issue"
"USA","Inflation is the biggest issue","Great survey","concerns"
"USA","All issues that were important to me were addressed in the debate","Somewhat confusing on issues that I don't quite understand","issue"
"USA","Corruption",NA,"concerns"
"USA","Nothing at all",NA,"concerns"
"France","l'héritage",NA,"injustice"
"USA","No not that I can recall",NA,"issue"
"USA","To become rich at some point",NA,"wish"
"USA","i wish to pay off my house and car.",NA,"wish"
"USA","Dictatorship and war happened all around the states",NA,"concerns"
"USA","History preservation
Food prices
Equal opportunity","This survey was very confusing at time.  It was very draining in my thought process.","concerns"
"USA","The lost of life","Nothing at this time","injustice"
"USA","My car.",NA,"concerns"
"USA","I would have to say immigration","Love the survey","issue"
"United Kingdom","Our current political parties.",NA,"concerns"
"USA","Nothing",NA,"concerns"
"USA","Police Officers shooting unarmed citizens.","Thanks For The Opportunity!","injustice"
"USA","no",NA,"issue"
"USA","Taxes going up as well as the price of living",NA,"concerns"
"USA","War","Good survey","injustice"
"USA","No",NA,"issue"
"USA","The unjustified deaths of African Americans citizens by the police system due to police brutality","Great clear survey I really enjoyed giving my honest opinion thanks for the opportunity","injustice"
"USA","Political corruption","No further comments","concerns"
"USA","Debt","No thank you","concerns"
"USA","Inflation,  local and state taxes, and family",NA,"concerns"
"USA","Unemployment","I like it","issue"
"USA","My health, happiness....finances",NA,"concerns"
"USA","Not having food","No","injustice"
"USA","Unemployment rate is crazy. People aren't hiring people with criminal backgrounds and it's a major issue for people that aren't even felons.",NA,"issue"
"USA","January six rioters was released on a pardon",NA,"injustice"
"USA","my main concerns are not having enough money for things",NA,"concerns"
"USA","The injustice of the economy",NA,"injustice"
"USA","Racism  ,and classism","None","injustice"
"USA","The greatest injustice is the gun control","I thank you for this survey, it's a lot of things that can be fixed","injustice"
"USA","The safety of woman","This was shorter then I expected","issue"
"USA","Inflation","Good survey","injustice"
"USA","The environment in the future and present","Very interesting and informative survey","issue"
"USA","the issue that is important to but is neglected in the public debate is the economy.","I have no comments thoughts,or suggestions .","issue"
"USA","that whomever had the authority to stop trump from becoming elected again after being convicted of numerous felonies and letting him run/tare down the country, and continue his RACIST ways on the American people especially people of color. Also, ruined our relationship with all of our allies!",NA,"injustice"
"USA","inflation, tariffs, costs of goods rising",NA,"concerns"
"USA","the fact that donald trump is president again is crazy and scary he should be in jail","very insightful survey","injustice"
"USA","Abortion rights","No comments for this survey as of now","issue"
"USA","Don't know","Very good survey questions","wish"
