"country_name","field","comment_field","variant_field"
"Spain","Vivienda
Empleo joven
Cambio climático",NA,"issue"
"Italy","la poverta'","no comment","injustice"
"Germany","Ich möchte mehr finanzielle Stabilität, ich möchte eine zusätzliche Einkommensquelle","Es ist eine tolle Idee, bei dieser Umfrage 100 Euro zu gewinnen. Wenn ich gewinne, werde ich es einer Umweltorganisation in meiner Nähe spenden.","wish"
"Germany","Wenn man als AOK Patient die prof. Zahnreinigung nicht bezuschusst bekommt, weil ich einen Pflegegrad habe.",NA,"injustice"
"Poland","Normalnie zarabiać godnie w stosunku do wydatków i inflacji być pracownikiem a nie robotem",NA,"wish"
"Italy","immigrazione tasse",NA,"concerns"
"Spain","Ayudas al nacimiento de hijos","Muy informativa","issue"
"Germany","Dass es immer, überall und in jedem Bereich Ungerechtigkeiten geben wird. Eine generelle Gerechtigkeit wird es nie geben.","Ich befürchte, mit der Kurve zur Einkommensverteilung werden noch andere ihre Schwierigkeiten haben; ich musste leider passen","injustice"
"Germany","nein",NA,"issue"
"United Kingdom","Remove illegal immigrants",NA,"wish"
"Spain","Nada.",NA,"wish"
"Italy","Sanità e diritti delle donne e delle minoranze",NA,"issue"
"Italy","A livello familiare, gestire lavoro casa e figli; a livello generico o di società, garantire la sicurezza a me e alla mia famiglia, delinquenza e immigrazione",NA,"concerns"
"Spain","SALUD, DINERO Y AMOR",NA,"wish"
"Germany","Bildung",NA,"issue"
"Germany","Tierschutz",NA,"issue"
"Spain","Inmigración ilegal inflación y delincuencia",NA,"concerns"
"Poland","Niedożywienie w wielu rejonach świata, podczas gdy inni wyrzucają nadwyżki żywności do śmietnika.","brak uwag","injustice"
"United Kingdom","The environment",NA,"issue"
"Italy","Il clima, la sanità",NA,"concerns"
"Italy","la povertà di molti contro la ricchezza di pochi",NA,"injustice"
"United Kingdom","Wars","Electric cars are yet to be proven to be totally sustainable","injustice"
"Germany","Trump",NA,"concerns"
"Italy","la situazione abitativa",NA,"issue"
"Germany","Ungerechtigkeit",NA,"issue"
"Italy","Il potere che dà il denaro per essere insensibili","Tra perdenti e non la scala non lascia opzione ragionevoli.","injustice"
"Italy","Famiglia tradizionale",NA,"issue"
"Spain","Porque me gustaría que te haya gustado el trabajo del los técnicos experiencia","Gracias","concerns"
"Spain","No",NA,"injustice"
"Germany","weniger Staat",NA,"issue"
"Poland","Własnego domu",NA,"wish"
"Italy","Un po di soldi",NA,"wish"
"Germany","Gesundheit",NA,"concerns"
"Spain","Si, la discriminación",NA,"injustice"
"United Kingdom","Ethnicity conflict and sexual discrimination",NA,"injustice"
"Germany","Schere zwischen arm und reich.","Ich habe keine weiteren Anmerkungen.","injustice"
"Italy","Divisioni fra ricchi e poveri","Sondaggio giusto,non di parte","injustice"
"Switzerland","Migration",NA,"concerns"
"Spain","Los problemas que van a generar los aranceles.",NA,"concerns"
"United Kingdom","Illegal immigration",NA,"issue"
"Spain",NA,NA,"wish"
"Spain","guhgygf yuhgyg yugh ygfg hyugf ytgyu gy gh uygy",NA,"injustice"
"Poland","Losy córki
Sytuacja polityczna w Polsce","bez uwag","concerns"
"USA","Racism",NA,"injustice"
"Switzerland",NA,NA,"wish"
"Germany","Krieg",NA,"concerns"
"Italy","Potere giudiziario",NA,"injustice"
"USA","I have everything that I need.","Thanks.","wish"
"USA","system racism, discrmination and inequality based on race or ethnicity","i like the survey it makes me know more about global warming","injustice"
"United Kingdom","The protection of those who have suffered traumatic brain injury.  The lack of understanding .in judicial system, police, probation service etc.","This survey focussed me on the.inequalities in our society; what can I do to address this imbalance? I feel guilty about my wealth but it has been achieved by hard working and educating myself on financial matters so that I could take full advantage.  Maybe campaigning for financial education in high school is what would help.","issue"
"Germany","Rentenarmut",NA,"issue"
"USA","The inflation of all goods and services but really not an increase in income.",NA,"concerns"
"United Kingdom","Threatened to be homeless.",NA,"concerns"
"USA","Human life at all levels","Thanks for your help and support","issue"
"Italy","Istruzione",NA,"issue"
"Spain","Cobrar un poco más de pensión",NA,"wish"
"Germany","neue küche","alles in ordnung","wish"
"United Kingdom","Having enough money to buy a house",NA,"concerns"
"Spain","Más salud y amor","Una encuesta muy práctica y que espero que sirva de algo","wish"
"Italy","ce ne sono tante",NA,"injustice"
"Germany","Wirtschaftschaos durch Trumps Steuern.",NA,"concerns"
"Italy","Mi pare che nel dibattito pubblico si questione di tutto","Un buon sondaggio","issue"
"Spain","El acceso a la vivienda",NA,"issue"
"Italy","la sicurezza in italia dei femminicidi e la educazione civica a scuola","bisognerebbe fare tutti qualcosa per salvare il nostro mondo
","issue"
"Spain","Explotar el trabajo ajeno","Es muy importante que la ayuda a los países pobres vaya a la población y al desarrollo y no a los gobernantes que se enriquecen y hacen a sus países más pobres,creo que primero hay que acabar con la corrupción y las dictaduras a nivel mundial.","injustice"
"USA","Be healthy and happy",NA,"wish"
"Italy","La lotta alla povertà",NA,"issue"
"United Kingdom","Cost of living , pension age increase , costs of housing for youngsters",NA,"concerns"
"Italy","Educazione alimentare da impartire fin dall'età infantile.","Nda","issue"
"United Kingdom","Nothing comes to mind","I found the survey enjoyable and would happily take more","issue"
"United Kingdom","THE imprisonment & eventual death of Alexai Navalny",NA,"injustice"
"Poland","Życie","Nie mam uwag","concerns"
"Spain","Salud",NA,"wish"
"Germany","das sich meine gesundheit verbessert","sehr interessante umfrage, hat sehr wichtige themen behandelt","wish"
"USA","Equality","It's an interesting survey","issue"
"USA","I want to be unforgettable manager","Thanks for your help and support","wish"
"Spain","Que me toque la lotería o una plaza fija de maestro","Había aspectos difíciles,  como la distribución de la riqueza.","wish"
"United Kingdom","lack of affordable housing for young couples and single people","interesting thoughtfull survey","issue"
"United Kingdom","people getting money from the government when they havent paid anything in, and the pensioners being left out",NA,"injustice"
"Spain","No necesito nada  y lo único que deseo es poder ver amanecer cada día.","Ha sido una encuesta que me ha hecho pensar. Me ha encantado.","wish"
"United Kingdom","economy generally",NA,"concerns"
"Spain","necesito sacarme el carnet del coche, estabilidad economica para poder vivir sin mis padres y un trabajo que me ilusione",NA,"wish"
"Spain","Siempre necesito la ayuda del Padre Celestial en este mundo tan problematico y lleno de conflictos,realmente solo no podria superar tantas dificultades.Shalom",NA,"wish"
"Spain","La inflación de los precios y la delincuencia",NA,"concerns"
"Spain","La biodiversidad española que está en declive por el cambio climático y la acción humana.",NA,"issue"
"United Kingdom","Immigration",NA,"injustice"
"United Kingdom","don't know",NA,"wish"
"USA","How we are treating the planet.",NA,"injustice"
"Italy","Immigrazione",NA,"issue"
"Germany","Meine Zukunft","Keine","concerns"
"France","de revenus plus justes",NA,"wish"
"France","d'argent, acheter une maison, changer de voiture, payer mon mariage","enquête avec des questions assez complexes","wish"
"United Kingdom","In my opinion, the greatest injustice of all is that hard work is not rewarded in this country. We penalise those who work hard by raising their taxes (thus encouraging people to emigrate) while raising living costs left, right and centre. It's impossible to have a good quality of life in this country unless you were lucky enough to be born wealthy.",NA,"injustice"
"France","Immogration",NA,"issue"
"France","Sécurité, inflation, avenir de ma fille",NA,"concerns"
"France","Pourquoi rien est mis en place sérieusement pour la protection des femmes et enfants dans le cadre de violence conjugale et l’éradication de pédophilie?","Je ne fais absolument pas confiance sur l’affirmation de détérioration de climat ni ONU ni aucun autre structure mondial à ce sujet. C’est de la pure propagande pour faire enrichir davantage les plus riches. Le but est de dominer la population, l’endoctriner, lobotomised…","issue"
"Spain","Paz en el mundo y salud para toda mi familia.",NA,"wish"
"United Kingdom","Not torturing murderers",NA,"injustice"
"Poland","rozliczenie poprzedniej władzy-PIS",NA,"issue"
"Italy","Un futuro tranquillo per i miei figli","Il sondaggio è in parte comprensibile, forse dovrebbe essere più specifico nel sostenere che l'economia mondiale dovrebbe aiutare i paesi a basso pil,con un debito pubblico elevato ed utilizzare il denaro dei più ricchi per il cambiamento climatico e il welfare","wish"
"United Kingdom","environmental issues","Study are good and informative.","issue"
"Poland","zle traktowanie biednych",NA,"injustice"
"Poland","marzę o zmianie samochodu, ale moja emerytura nie wystarczy mi",NA,"wish"
"Spain","Encontrar trabajo, pagar las facturas de la universidad y ahorrar",NA,"concerns"
"Italy","Soldi, libertà finanziaria, un partner",NA,"wish"
"Spain","Dejar morir de hambre a una persona","Sin comentarios","injustice"
"Spain","Un poco más de salud, y un poquito más de dinero, pero con más salud me conformo, para las personas que quiero y para mi también","Ya se podía hacer realidad lo que se propone aquí. El mundo tendría una oportunidad","wish"
"Germany","Klima und Sicherheit",NA,"issue"
"Italy","Che Putin e Trump si tolgano dalla scena politica",NA,"wish"
"Spain","Las ayudas que solo dan a los inmigrantes",NA,"issue"
"Poland","Nie",NA,"issue"
"Spain","Me gustaria tener mas dinero para cumplir mis sueños",NA,"wish"
"Germany","bin zufrieden","Bereitschaft für die Umwelt was zu tun, ist bei den Menschen noch nicht so recht angekommen","wish"
"France","La reversion","Ras","issue"
"USA","My is wish is to have enough money in my name and no debt",NA,"wish"
"Italy","inflazione, guerre e cambiamenti climatici",NA,"concerns"
"Poland","Pomoc w kosztach leczenia raka",NA,"issue"
"France","je souhaite que ma famille soit en bonne santé
je souhaite réussir le concours de professeur des écoles",NA,"wish"
"Spain","La Inseguridad Ciudadana
La vivienda para jovenes
La corrupción",NA,"concerns"
"Spain","Nada",NA,"wish"
"France","Le pouvoir d’achat, l’écologie et la montée du « fascisme »",NA,"concerns"
"USA","Peace and good health","Some questions were confusing","wish"
"United Kingdom","That people with criminal records get help finding work and I have a degree, no criminal record and I can't get a job",NA,"injustice"
"USA","I really don't have any needs but 7i do wish to travel the world sometime on my life, I wish my children grow up to a better world then we ate in now",NA,"wish"
"Poland","kompetencje",NA,"issue"
"Spain","La salud,el clima y la bolsa","Pienso que no debería haber grandes fortunas , que debería repartirse con los más pobres","concerns"
"United Kingdom","Cost of living, Donald Trump, Labour government policies, my council going bankrupt",NA,"concerns"
"United Kingdom","Wars
Climate damage
Population",NA,"concerns"
"Spain","Falta acceso a vivienda",NA,"injustice"
"Spain","Dinero",NA,"wish"
"United Kingdom","Have a normal life",NA,"wish"
"United Kingdom","Immigration
NHS and social care
Cost of living",NA,"concerns"
"Germany","Bildung",NA,"issue"
"Spain","La atención a los mayores",NA,"issue"
"Switzerland","Das manche Mensch für ihre arbeit mehr geld bekommen als andere die das gleiche tun znd das mütter jein lohn bekonmen",NA,"injustice"
"Spain","el empleo, sanidad",NA,"concerns"
"Germany","ich mit meiner rente und kaum ersparnissen im pflegefall meinen kindern zur last falle. mit 79 jahren, einem lebenslangen berufsleben macht es mich betroffen, wenn menschen (politiker), die im monat soviel geld zur verfügung haben, wie ich das ganze jahr, davon sprechen, daß sich heute jeder etwas einschränken müsse.","r inhalt der umfrage war recht schwer zu beantworten, da es sehr von der momentanen situation des befragten abhängt","concerns"
"USA","Political corruption by the POTUS and Elon Musk","Nothing","concerns"
"France","Le travail, l'argent et le pouvoir d'achat","Très bonne enquête, à suivre dans le futur","concerns"
"France",NA,NA,"concerns"
"USA","Civil liberties, the economy, the environment.",NA,"concerns"
"Switzerland","Vorrei aprire il mio kindergarten privato bilingue a Zurigo, in collaborazione con una mia cara collega di lavoro","Un sondaggio ben fatto, su tematiche interessanti e che fanno davvero riflettere. Per chi, come me, ha dei figli ancora relativamente piccoli, queste domande aprono scenari futuri vari e da approfondire.","wish"
"Poland",NA,NA,"issue"
"Germany","heutige Jugend",NA,"issue"
"Italy","la sicurezza per tutti non solo per quelli che viaggiono con una scorta a nostre spese",NA,"issue"
"Spain","El viento","Todo bien, pero cuesta comprender algunos conceptos","concerns"
"France","De rien",NA,"wish"
"Germany","Das der Deutsche für das Ausland ausgebeutet wird, und selbst Flaschen sammelt",NA,"injustice"
"United Kingdom","the finacial gap between the rich and poor.","good topic","injustice"
"USA","I am concerned about climate change and global warming",NA,"concerns"
"Switzerland","Aiuti alle famiglie","Non ho commenti","issue"
"Italy","clima e le guerre",NA,"concerns"
"France","l insecurite","trop de bourage de crane","concerns"
"France","Quid de l'avenir de la planète face au capitalisme exacerbé ?",NA,"issue"
"Spain","Ninguna en particular",NA,"concerns"
"Germany","Die Altersarmut",NA,"concerns"
"Italy","crisi economica aumento prezzi",NA,"concerns"
"USA","The impact of tariffs on the economy","no comments","concerns"
"Spain","mas viajes y que mantenga mi salud en buen estado.","gracias.","wish"
"Switzerland","Non saprei.","Sondaggio molto interessante","issue"
"Germany","Wirtschaft",NA,"issue"
"France","Je ne sais pas","Non rien à ajouter","injustice"
"Poland","Wpuszczanie do Polski nielegalnych emigrantów","Nie ma sensu jakakolwiek polityka klimatyczna, człowiek nie ma wpływu na ocieplenie klimatu, wszelkie działania w tym kierunku to tylko wymysły wielkich korporacji,  które liczą tylko na zwiększenie swoich zysków","issue"
"United Kingdom","One thing that sometimes doesn't get as much consistent attention in public debate as it deserves is the long-term well-being and support for young carers.

Young carers are children and teenagers who take on significant caring responsibilities for family members who are ill, disabled, or have mental health or addiction problems. This can include things like personal care, household chores, emotional support, and managing medication.

While there's some awareness of young carers, the ongoing challenges they face – like balancing school with caring duties, the emotional toll it takes, potential social isolation, and the long-term impact on their education and future opportunities – often aren't discussed enough in a way that leads to significant and lasting support systems. It's a really important issue because these young people are taking on huge responsibilities, and it can really affect their childhood and future.","No comments","issue"
"France","l inflation",NA,"concerns"
"France","pas de souhait particulier. Je souhaite être le plus longtemps possible en bonne santé","aucun commentaire ou suggestion a faire","wish"
"Germany","Einkommensunterschied","Nein danke","injustice"
"France","Ridicule cde parler de désendettement alors que l'endettement continue d'ugmenter chaque jour...",NA,"issue"
"France",NA,NA,"issue"
"France","un gouvernement de branquignoles",NA,"injustice"
"Spain","En este momento nada en particular",NA,"wish"
"Switzerland","Gagner au loto","Je pas des commentaires","wish"
"Italy","Eliminare il lavoro precario",NA,"issue"
"USA","Peace in the world","Climate change needs to happen but I’m unsure how quickly it will as I don’t believe alternative resources are close to being where they need to be","wish"
"Italy","La guerra",NA,"injustice"
"Germany","Das Erstarken des Rechtsextremismus/Faschismus",NA,"concerns"
"France","Pourquoi il y a un dogme de la réduction du déficit ? Faut il absolument le réduire, pourquoi et comment ?",NA,"issue"
"Italy","costo della vita",NA,"issue"
"France","De l amour de la paix de la sécurité","J espère gagner les 100 euros","wish"
"Switzerland",NA,NA,"injustice"
"France","Que tout le monde ne mange pas à sa faim",NA,"injustice"
"USA","Health and wellness 
Global issues and current events
Social connections and communitPersonal growth and development
Financial stability

","Reducing energy consumption 
Using public carpooling 
Let's work to together migitate climate change impacts","concerns"
"Italy","Economiche",NA,"concerns"
"Spain","Equiparación salarial y jubilación digna CNP y GC",NA,"issue"
"USA","I wish for consistent happiness and money that never runs out","The survey seemed fair and balanced in its questions. I appreciated the clear wording and neutral tone throughout. Thank you for giving space for different perspectives.","wish"
"Poland","Brak stabilności finansowej, wysokie ceny",NA,"concerns"
"Spain","La inestabilidad internacional.","Muy interesante.","concerns"
"Spain","EL ROBO CONSTANTE A LOS CIUDADANOS DE NUESTRO DINERO A TRAVES DE LOS IMPUESTOS DE TODO TIPO QUE EXISTEN EN ESPAÑA",NA,"issue"
"Germany","der Klimawandel und Trump",NA,"concerns"
"Spain","Hay muchas injusticias","Muy buena el tema","injustice"
"France","Financière et recherche d'emploi",NA,"concerns"
"Spain","El cambio climatico","Me ha parecido muy interesante.","issue"
"France","Racisme","Enquête intéressante","injustice"
"United Kingdom","My family upkeeps",NA,"concerns"
"Italy","la salute, la pace nel mondo, l'inquinamento, l'immigrazione, la mancanza di lavoro",NA,"concerns"
"Italy","L'educazione finanziaria, energia nucleare, competitività",NA,"issue"
"France","opprimer le droit d'expression à une personne","merci","injustice"
"USA","social security
401l
k","I felt it was quite informative","concerns"
"Italy","Green deal.","Cancellate il Green deal. Mandate in carcere la Ursula vonderleien","injustice"
"Germany","Die Leute die das Land am laufen halten nicht gehört werden",NA,"injustice"
"France","D ARGENT, DE RESPECT,DE SECURITE, DE BONHEUR",NA,"wish"
"Spain","Una moto",NA,"wish"
"Germany","Gesundheit","wieder Atomenergie erzeugen","concerns"
"Germany","Steuerrecht",NA,"injustice"
"Italy","Gli stipendi bassi costo della vita alto","Sondaggio interessante","concerns"
"Germany","Altersarmut","Mehr davon, stimmt mich optimistisch","issue"
"Italy","Troppe tasse per gli artigiani autonomi",NA,"issue"
"Germany","Ich bin zufrieden mit dem, was ich habe. Meine Familie soll es gut ergehen.",NA,"wish"
"Italy","Stabilità governo
Aumento costo vita
Salute",NA,"concerns"
"France","Pour les lois ne sont pas respectées en France","Pas de commentaire","issue"
"United Kingdom","Money","Ĥhhhhh","concerns"
"Spain","La educacion","Una encuesta partidista de izquierda","issue"
"Germany","Keine Angaben
","Kein Kommentar","issue"
"Spain","nada",NA,"wish"
"France","J AURAI BESOIN QUE L ON ME VALORISE MIEUX A MON TRAVAIL QU ON UTILISE MES COMPETENCES AQUISES DEPUIS PLUSIEURS ANNEES POUR L INSTANT CE N EST PAS LE CAS",NA,"wish"
"USA","Immigration, the Democratic Party, wokeness, antisemitism,the government wasting money!","I feel we should look out for America first..","concerns"
"Spain","Que los corruptos no reciben castigo",NA,"injustice"
"Italy",NA,NA,"issue"
"Spain","Mi salud, mi familia",NA,"concerns"
"United Kingdom","I don't know. I don't know what is mention in the public debate.","I think this survey is good as it makes you think of different views relating to Climate and Global and the questions are nice and big to read and stands out. EXCELLENT who did the layout of this survey.","issue"
"Spain","Salud y vivir con momentos felices",NA,"wish"
"Italy","non saprei.",".................","concerns"
"USA","Nothing comes to mind at this time","I have no comment to enter at this time","wish"
"United Kingdom","That we are in the 21st Century and there are still people starving/malnourished/homeless ALL over the World.",NA,"injustice"
"United Kingdom","Animals being abused and murdered in this day and age when there are plenty of alternatives.","I thought it was interesting and followed my own feelings on this matter but I dont really consider myself left or right wing .","injustice"
"United Kingdom","Immigration becoming the norm","No comment , too long","injustice"
"Spain","La miseria y el sufrimiento de los niños en todo el mundo",NA,"injustice"
"Spain","salud",NA,"wish"
"France","J'ai besoin de donner du sens à ma vie. Je souhaite davantage de justice sociale",NA,"wish"
"Italy","Salute precaria e disoccupazione",NA,"concerns"
"Spain","el dialogo entre todas las ideologias","nada que añadir","issue"
"Spain","Buscar trabajo y la situacion del pais",NA,"concerns"
"Switzerland","Legge uguale",NA,"issue"
"Germany","soziale Ungleichheit",NA,"issue"
"Spain","Todo",NA,"issue"
"Italy","sanità allo sbando",NA,"issue"
"Italy","Discriminazione",NA,"injustice"
"Spain","La sanidad",NA,"issue"
"USA","To live each day like it's my last.",NA,"wish"
"Spain","medio ambiente","me ha parecido correcta","issue"
"United Kingdom","Cost of living",NA,"issue"
"Italy","La situazione internazionale 
La recessione
Il cambiamento climatico",NA,"concerns"
"United Kingdom","An easier life",NA,"wish"
"Spain","Un trabajo estable y vida tranquila","La encuesta es muy muy interesante.
Presenta problemas actuales y a futuro que ayudan a mejorar la toma de decisiones.","wish"
"Spain","Nada","Nada","wish"
"Spain","liquidar la hipoteca",NA,"wish"
"Spain","Quedarme como estoy ,con alguna mejora","Debemos ayudarnos entre todos","wish"
"United Kingdom","IMMIGRATION LEVELS",NA,"concerns"
"Spain","Deseo mejores salarios, menos impuestos, vivienda digna, derechos para las mujeres, y para la comunidad lbgqt",NA,"wish"
"Germany","weis nicht","weis nicht","injustice"
"USA","My main concern is how to get by day by day thrive in this inflation","This a good way to gather people opinion about government policy","concerns"
"France","La crise climatique
L'avenir de mes enfants",NA,"concerns"
"Italy","sto bene così","Alcune domande sono poco chiare","wish"
"USA","I'm deeply troubled about the impact of climate change especially how weather events seem to be happening more often these days.As a mother, I'm worried because there's nothing that I can do to protect my children from the swiftly changing world.","The survey felt somewhat confusing and difficult to follow due to the complexity of some of the questions.","concerns"
"France","'- Le bouleversement climatique et ses conséquences terribles 
- la guerre et Ukraine et ses conséquences mondiales...
- le fou de trump aux commandes de la plus grosse puissance mondiale, allié a Musk et Poutine (?)
- le conflit commercial des taxes entre la Chine et les USA...","Difficile de jauger ces aides par l'état, nous ne faisons pas partie de la cour des comptes, nous ne connaissons pas le budget des différents etats","concerns"
"Germany","Krieg",NA,"injustice"
"Spain","Vivir tranquila",NA,"wish"
"Spain","la riqueza está mal distribuida",NA,"injustice"
"Spain","ser feliz, terminar mi carrera universitaria y tener suficiente dinero como para que me permita no preocuparme por llegar a fin de mes",NA,"wish"
"Italy","Avrei bisogno di ricominciare a gestire meglio il mio tempo extra lavoro",NA,"wish"
"Spain","Los conflictos entre países","Es una encuesta muy amena.","concerns"
"USA","elimination of gay rights",NA,"issue"
"USA","Increased cost of living",NA,"concerns"
"USA","A lot if people lack common sense. I suggest it be thought in school and churches. Also word of wisdom is importance","It’s all good. No questions are biased","issue"
"Germany","frieden,mehr geld,gesundheit",NA,"wish"
"Spain","Que unas pocas personas con un poder desorbitado lo controlen todo y decidan sobre la economía, el ecosistema, la política... diciendo como los demás debemos vivir",NA,"injustice"
"Poland","Dobra praca","Propaganda","wish"
"United Kingdom","The treatment of al Palestinians","In the previous question there was no mention of being Scottish? Only British. I do not consider myself British due to Westminster bias in favour of the English.","injustice"
"Germany","Krieg",NA,"concerns"
"United Kingdom","Climate change",NA,"issue"
"France","RAS","RAS","concerns"
"Poland","ludzka chciwość","baaaaardzo ciekawie","injustice"
"Italy","tasse",NA,"concerns"
"Spain",NA,NA,"wish"
"Germany","der Krieg",NA,"concerns"
"Spain","Elcomportamiento poco etico y agresivo de los politicos","Consideraciones en extremo idealistas. Estamos demasiado lejos de las propuestas. A los politicos no les interesa realmente eso","issue"
"Spain","Pues si se suspende las procesiones, no encontrar trabajo, etc.",NA,"concerns"
"Italy","malattie ai bambini",NA,"injustice"
"Spain",NA,NA,"wish"
